{
  "meta": {
    "standard": "CNS/ISO/IEC 27001:2023 (對應 ISO/IEC 27001:2022)",
    "version": "0.5.0",
    "accent": "#3b82f6",
    "note": "所有說明為自行撰寫之白話轉譯，未複製標準正文（版權）。條款編號與標題為事實引用。",
    "linkTypes": [
      "feeds",
      "treats",
      "selects",
      "implements",
      "aligns",
      "contains"
    ]
  },
  "architectures": [
    {
      "id": "pdca",
      "name": "PDCA 管理循環",
      "summary": "ISMS 的運轉引擎：規劃→執行→查核→行動，對應條款 6/7→8→9→10。"
    },
    {
      "id": "lifecycle",
      "name": "產品/服務生命週期",
      "summary": "先搞懂自己在保護什麼：界定範圍與資產的起點（條款 4）。"
    },
    {
      "id": "risk",
      "name": "風險管理 (ISO 31000)",
      "summary": "27001 的心臟，採 ISO 31000 方法論，經 ISO 27005 落地到條款 6.1。"
    },
    {
      "id": "controls",
      "name": "附錄 A 控制措施",
      "summary": "4 主題 93 控制：組織 A.5 / 人員 A.6 / 實體 A.7 / 技術 A.8。"
    }
  ],
  "nodes": [
    {
      "id": "band-devops",
      "type": "cross-cutting-band",
      "ref": "ISO/IEC 22989",
      "title": "開發與營運",
      "title_en": "Development and operations (MLOps)",
      "summary": "建模、部署、監控、再訓練的迭代閉環，貫穿全程",
      "explanation": "AI 不是上線就結束：要反覆建模、訓練、部署，上線後持續監控效能與資料漂移、必要時再訓練，形成不斷迭代的開發-營運閉環（MLOps）。這是工程實務層，對映 ISO/IEC 22989 生命週期裡「design and development」與「operation and monitoring」兩個階段之間的反覆迭代，而不是標準明列的單一概念，因此把它當成橫向貫穿的關注帶來看。對應 ISMS 的條款 8 運作管制與附錄 A.8 技術控制（變更管理、安全開發、日誌監控），也呼應 PDCA 的執行（Do）與查核（Check）。",
      "layers": [
        "lifecycle"
      ],
      "subconcepts": [
        {
          "label": "持續監控",
          "note": "上線後追蹤模型效能與資料／概念漂移。"
        },
        {
          "label": "再訓練與版本控制",
          "note": "資料或環境改變時更新模型並管理版本。"
        }
      ],
      "iso27001": "8.1"
    },
    {
      "id": "band-transparency",
      "type": "cross-cutting-band",
      "ref": "ISO/IEC 22989",
      "title": "透明性與可解釋性",
      "title_en": "Transparency and explainability",
      "summary": "資訊可取得、決策可被人理解與追溯",
      "explanation": "指 AI 的資訊要可取得、決策機制能用人話解釋。從設計階段就得決定揭露什麼、留下什麼紀錄、模型能不能被追溯與理解，這要求貫穿資料、訓練、部署到運維全程，讓使用者與稽核者看得懂、追得到。對應 ISMS 的文件化資訊（7.5）與日誌記錄（A.8.15），也是對利害關係人要求（4.2）的回應。",
      "layers": [
        "lifecycle"
      ],
      "subconcepts": [
        {
          "label": "透明性 Transparency",
          "note": "讓相關人能拿到系統開發、部署與運作的相關資訊，不被黑箱擋住。"
        },
        {
          "label": "可解釋性 Explainability",
          "note": "把模型怎麼得出結果，用人聽得懂的方式講清楚。"
        }
      ],
      "iso27001": "7.4 / 7.5"
    },
    {
      "id": "band-security-privacy",
      "type": "cross-cutting-band",
      "ref": "ISO/IEC 22989",
      "title": "安全與隱私保護",
      "title_en": "Security and privacy",
      "summary": "全程保護資料、模型與輸出的機密與隱私",
      "explanation": "AI 全程都有資安與個資風險：訓練資料、模型權重、推論 API 與輸出都要保護，還得防資料中毒、對抗式攻擊、模型竊取與隱私外洩。這正是 ISMS 的本業——以機密性、完整性、可用性三性搭配附錄 A 全套控制來守護，並可延伸到個資保護（ISO 27701），是資安與 AI 治理最直接的交集。",
      "layers": [
        "lifecycle"
      ],
      "subconcepts": [
        {
          "label": "資料中毒／對抗式攻擊",
          "note": "惡意輸入污染訓練資料或誤導推論結果。"
        },
        {
          "label": "模型與隱私保護",
          "note": "防模型權重遭竊、防訓練資料洩漏個資。"
        }
      ],
      "iso27001": "8 / 附錄A"
    },
    {
      "id": "band-risk",
      "type": "cross-cutting-band",
      "ref": "ISO/IEC 22989",
      "title": "風險管理",
      "title_en": "Risk management",
      "summary": "全程識別與處理 AI 特有風險的循環",
      "explanation": "每個生命週期階段都要識別、分析、處理並持續監控 AI 特有風險（偏誤、不可靠、安全與倫理衝擊），不是做一次評估，而是貫穿全程的循環。對應 ISMS 條款 6.1 的風險評鑑與處理，方法上採 ISO 31000；AI 專屬風險還可參考 ISO/IEC 23894（AI 風險管理）與 AI 管理系統標準 ISO/IEC 42001。",
      "layers": [
        "lifecycle"
      ],
      "subconcepts": [
        {
          "label": "AI 特有風險",
          "note": "偏誤、不可靠、自動化決策帶來的安全與倫理衝擊。"
        },
        {
          "label": "持續再評估",
          "note": "模型或環境變化時重新評鑑風險。"
        }
      ],
      "iso27001": "6.1"
    },
    {
      "id": "band-governance",
      "type": "cross-cutting-band",
      "ref": "ISO/IEC 22989",
      "title": "組織治理",
      "title_en": "Governance",
      "summary": "最上層的政策、問責與監督，統籌全局",
      "explanation": "最上層的問責與監督：訂政策、分派角色職責、建立審查與監督機制，確保 AI 全程符合組織目標、倫理與法規，並統籌底下其他關注帶。對應 ISMS 的條款 5 領導與承諾、條款 4 組織背景與附錄 A.5 組織控制；在 AI 領域則對應專門的 AI 管理系統標準 ISO/IEC 42001（AIMS）。",
      "layers": [
        "lifecycle"
      ],
      "subconcepts": [
        {
          "label": "角色與問責",
          "note": "界定 AI 提供者、開發者、使用者等角色的職責。"
        },
        {
          "label": "政策與監督",
          "note": "訂定 AI 政策並建立審查與監督機制。"
        }
      ],
      "iso27001": "5"
    },
    {
      "id": "ai-inception",
      "type": "lifecycle-stage",
      "ref": "ISO 5338 §6.4.1–6.4.3",
      "title": "起始（概念形成）",
      "title_en": "Inception",
      "summary": "把想法變成明確的問題、需求與系統要求。",
      "explanation": "AI 系統的最前段。先釐清這個 AI 要解決什麼業務或任務問題（6.4.1），再問清楚利害關係人真正需要與在意什麼（6.4.2），最後轉成可驗收的系統需求（6.4.3）。AI 的特別之處在於需求常和資料、效能與可接受錯誤率綁在一起，這裡沒想清楚，後面模型就會走偏。",
      "layers": [
        "lifecycle"
      ],
      "subconcepts": [
        {
          "label": "6.4.1 業務或任務分析（Business or mission analysis）",
          "note": "釐清這個 AI 要解決的業務／任務問題與機會，界定問題範圍。"
        },
        {
          "label": "6.4.2 利害關係人需要與需求定義（Stakeholder needs & requirements definition）",
          "note": "問清楚使用者與關係人真正需要什麼、在意什麼，並轉成需求。"
        },
        {
          "label": "6.4.3 系統需求定義（System requirements definition）",
          "note": "把利害關係人需求轉成可驗收的系統技術需求。"
        }
      ],
      "iso27001": "4.2 / 6.1"
    },
    {
      "id": "ai-design-dev",
      "type": "lifecycle-stage",
      "ref": "ISO 5338 §6.4.4–6.4.10",
      "title": "設計與開發",
      "title_en": "Design & development",
      "summary": "定架構、做設計、取得知識與資料、實作並整合。",
      "explanation": "系統真正被打造的階段。先定整體架構（6.4.4）與細部設計（6.4.5），用系統分析（6.4.6）權衡效能、成本與風險；AI 專屬的是取得領域知識（6.4.7）與 AI 資料工程（6.4.8，蒐集、清理、標註、防偏誤）。接著實作模型與程式（6.4.9），再整合成完整系統（6.4.10）。",
      "layers": [
        "lifecycle"
      ],
      "subconcepts": [
        {
          "label": "6.4.4 系統架構定義（System architecture definition）",
          "note": "決定系統整體結構與主要元件如何組合。"
        },
        {
          "label": "6.4.5 設計定義（Design definition）",
          "note": "把架構細化成可實作的詳細設計。"
        },
        {
          "label": "6.4.6 系統分析（System analysis）",
          "note": "用分析與權衡支援設計決策（效能、成本、風險）。"
        },
        {
          "label": "6.4.10 整合（Integration）",
          "note": "把各元件組合成完整系統並確認介面正確。"
        },
        {
          "label": "6.4.7 知識獲取（Knowledge acquisition）",
          "note": "AI 專屬：取得並表述領域知識，供系統學習或推理。"
        },
        {
          "label": "6.4.8 AI 資料工程（AI data engineering）",
          "note": "AI 專屬：蒐集、清理、標註資料並降低偏誤與被攻擊風險。"
        },
        {
          "label": "6.4.9 實施（Implementation）",
          "note": "實際建出元件——含訓練模型與撰寫程式。"
        }
      ],
      "iso27001": "8.1"
    },
    {
      "id": "ai-vnv",
      "type": "lifecycle-stage",
      "ref": "ISO 5338 §6.4.11 / §6.4.13",
      "title": "查證與確證",
      "title_en": "Verification & validation",
      "summary": "確認「做對了」，也確認「做了對的東西」。",
      "explanation": "兩個容易混淆但不同的把關。查證（6.4.11）問「有沒有照規格正確做出來」，例如模型指標是否達標、程式是否符合設計；確證（6.4.13）問「放進真實情境是不是真的解決使用者的問題」。AI 行為從資料學來、不易預測，這兩關都要用測試資料與真實場景反覆驗。",
      "layers": [
        "lifecycle"
      ],
      "subconcepts": [
        {
          "label": "6.4.11 查證（Verification）",
          "note": "確認系統是否照規格正確建造（做對了）。"
        },
        {
          "label": "6.4.13 確證（Validation）",
          "note": "確認系統在真實情境是否滿足使用者需要（做了對的東西）。"
        }
      ],
      "iso27001": "8.1 / 9.1"
    },
    {
      "id": "ai-deployment",
      "type": "lifecycle-stage",
      "ref": "ISO 5338 §6.4.12",
      "title": "部署",
      "title_en": "Deployment",
      "summary": "把通過驗證的系統搬進正式營運環境。",
      "explanation": "轉移（6.4.12）指把開發完成的 AI 系統交付、安裝、上線到實際運作環境，包含訓練使用者、移交維運責任、確認能與既有系統銜接。對 AI 還要特別注意：上線環境的資料分布若和訓練時不同，效果可能掉，所以部署不是「丟上去就好」，要先準備好監控與可回復的機制。",
      "layers": [
        "lifecycle"
      ],
      "subconcepts": [
        {
          "label": "6.4.12 轉移（Transition）",
          "note": "把系統交付、安裝、上線到正式營運環境並移交維運。"
        }
      ],
      "iso27001": "8.1"
    },
    {
      "id": "ai-operation-monitoring",
      "type": "lifecycle-stage",
      "ref": "ISO 5338 §6.4.15–6.4.16",
      "title": "營運與監督",
      "title_en": "Operation & monitoring",
      "summary": "日常運行、監看表現並做維護修補。",
      "explanation": "上線後的長期照顧。營運（6.4.15）是讓系統穩定提供服務、監看使用與表現；維護（6.4.16）是修錯、更新、因應環境變化做調整。AI 的關鍵差異是模型會「變舊」——資料漂移或概念漂移會讓準確度悄悄下滑，所以監督不只看系統有沒有當機，更要盯模型表現有沒有退化。",
      "layers": [
        "lifecycle"
      ],
      "subconcepts": [
        {
          "label": "6.4.15 營運（Operation）",
          "note": "讓系統穩定提供服務並監看使用與表現。"
        },
        {
          "label": "6.4.16 維護（Maintenance）",
          "note": "修錯、更新、因應環境變化做調整。"
        }
      ],
      "iso27001": "8.1 / 9.1"
    },
    {
      "id": "ai-continuous-validation",
      "type": "lifecycle-stage",
      "ref": "ISO 5338 §6.4.14",
      "title": "持續確證",
      "title_en": "Continuous validation",
      "summary": "上線後仍持續重驗模型是否還可信。",
      "explanation": "這是 5338 為 AI 新增、傳統軟體沒有的流程（6.4.14）。模型不像一般程式裝好就固定，它的表現會隨真實資料改變而退化或產生新風險。持續確證就是定期拿新資料重新測試、比對效能與安全性，及早抓出資料漂移、概念漂移或新出現的偏誤，必要時觸發重新訓練或重新評估。",
      "layers": [
        "lifecycle"
      ],
      "subconcepts": [
        {
          "label": "6.4.14 持續確證（Continuous validation）",
          "note": "AI 專屬：上線後定期重測，抓資料／概念漂移與新風險。"
        }
      ],
      "iso27001": "9.1 / 10.1"
    },
    {
      "id": "ai-reevaluation",
      "type": "lifecycle-stage",
      "ref": "ISO 5338 §6.3.8 / §6.4.2 / §6.4.13",
      "title": "重新評估",
      "title_en": "Re-evaluation",
      "summary": "定期回頭檢視系統是否仍該存在、仍合格。",
      "explanation": "它不是單一固定流程，而是借助品質保證（6.3.8）、回頭重看利害關係人需求（6.4.2）與重做確證（6.4.13）的綜合動作。目的是定期自問：這個 AI 還符合當初目標嗎？需求變了嗎？品質與合規還守得住嗎？評估結果可能導向繼續維運、重大改版，或進入汰除。",
      "layers": [
        "lifecycle"
      ],
      "subconcepts": [
        {
          "label": "6.3.8 品質保證（Quality assurance）",
          "note": "確保流程與產出持續達到品質要求。"
        },
        {
          "label": "6.4.2 利害關係人需要與需求定義（Stakeholder needs & requirements definition）",
          "note": "回頭重看需求是否已經改變。"
        },
        {
          "label": "6.4.13 確證（Validation）",
          "note": "重做確證，確認系統仍滿足當初目標。"
        }
      ],